### ISSUE TITLE
ARM 环境无法运行

### ISSUE THREAD

**Issue by sdysj** [ccsexyz/kcpraw#2]
> root@armbox:~# ./kcpraw_client_linux_arm7 -c /etc/kcptun/xxx.json
2017/03/30 23:13:36 version: 20170330
2017/03/30 23:13:36 listening on: [::]:666666
2017/03/30 23:13:36 encryption: aes
2017/03/30 23:13:36 nodelay parameters: 1 20 2 1
2017/03/30 23:13:36 remote address: xxxxx:xxxx
2017/03/30 23:13:36 sndwnd: 128 rcvwnd: 512
2017/03/30 23:13:36 compression: false
2017/03/30 23:13:36 mtu: 1350
2017/03/30 23:13:36 datashard: 10 parityshard: 3
2017/03/30 23:13:36 acknodelay: false
2017/03/30 23:13:36 dscp: 46
2017/03/30 23:13:36 sockbuf: 4194304
2017/03/30 23:13:36 keepalive: 10
2017/03/30 23:13:36 conn: 1
2017/03/30 23:13:36 autoexpire: 0
2017/03/30 23:13:36 snmplog:
2017/03/30 23:13:36 snmpperiod: 60
2017/03/30 23:13:36 scavengettl: 600
2017/03/30 23:13:36 httphost:
2017/03/30 23:13:36 retry too many times
net.DialRAW
github.com/ccsexyz/kcp-go-raw.DialWithOptions
        /Users/johnsonjohn/Go/src/github.com/ccsexyz/kcp-go-raw/sess.go:15
main.main.func1.1
        /Users/johnsonjohn/Go/src/github.com/ccsexyz/kcpraw/client/main.go:374
main.main.func1
        /Users/johnsonjohn/Go/src/github.com/ccsexyz/kcpraw/client/main.go:416
github.com/urfave/cli.HandleAction
        /Users/johnsonjohn/Go/src/github.com/urfave/cli/app.go:485
github.com/urfave/cli.(*App).Run
        /Users/johnsonjohn/Go/src/github.com/urfave/cli/app.go:259
main.main
        /Users/johnsonjohn/Go/src/github.com/ccsexyz/kcpraw/client/main.go:455
runtime.main
        /usr/local/go/src/runtime/proc.go:185
runtime.goexit
        /usr/local/go/src/runtime/asm_arm.s:1017
createConn()
main.main.func1.1
        /Users/johnsonjohn/Go/src/github.com/ccsexyz/kcpraw/client/main.go:376
main.main.func1
        /Users/johnsonjohn/Go/src/github.com/ccsexyz/kcpraw/client/main.go:416
github.com/urfave/cli.HandleAction
        /Users/johnsonjohn/Go/src/github.com/urfave/cli/app.go:485
github.com/urfave/cli.(*App).Run
        /Users/johnsonjohn/Go/src/github.com/urfave/cli/app.go:259
main.main
        /Users/johnsonjohn/Go/src/github.com/ccsexyz/kcpraw/client/main.go:455
runtime.main
        /usr/local/go/src/runtime/proc.go:185
runtime.goexit
        /usr/local/go/src/runtime/asm_arm.s:1017

**Comment by sdysj** [comment]
原版可以运行。

**Comment by ccsexyz** [comment]
能提供tcpdump日志吗,命令是 tcpdump host <kcp-server-ip> and port <kcp-server-port> and proto tcp,先运行客户端再运行 tcpdump

**Comment by sdysj** [comment]
抓不了，貌似是程序错误，连接都还没建立就崩了，armv7 环境，原版运行得很好。

**Comment by sdysj** [comment]
https://github.com/ccsexyz/kcp-go-raw/blob/master/sess.go#L15

这里出问题？

**Comment by ccsexyz** [comment]
在服务端和客户端的配置文件里都把 ignrst 这个选项设置为 true 试试看

**Comment by sdysj** [comment]
也不行，错误一样。

**Comment by ccsexyz** [comment]
你在服务端抓包试试总可以吧

**Comment by ravageralpha** [comment]
```
root@kcp_server:~# tcpdump port 1333
tcpdump: verbose output suppressed, use -v or -vv for full protocol decode
listening on venet0, link-type LINUX_SLL (Linux cooked), capture size 65535 bytes
04:02:01.891828 IP my_ip.58210 > kcp_server.1333: Flags [F.], seq 616562700, ack 1139322821, win 60, length 0
04:02:02.374274 IP my_ip.58226 > kcp_server.1333: Flags [S], seq 480526890, win 29200, options [mss 1460,sackOK,TS val 587117977 ecr 0,nop,wscale 9], length 0
04:02:02.374449 IP kcp_server.1333 > my_ip.58226: Flags [S.], seq 2774439657, ack 480526891, win 65535, options [mss 1460,wscale 5,sackOK,eol], length 0
04:02:02.383455 IP my_ip.58226 > kcp_server.1333: Flags [.], ack 1, win 58, length 0
04:02:02.383517 IP my_ip.58226 > kcp_server.1333: Flags [P.], seq 1:138, ack 1, win 58, length 137
04:02:02.383771 IP kcp_server.1333 > my_ip.58226: Flags [P.], seq 1:216, ack 138, win 65535, length 215
04:02:02.392845 IP my_ip.58226 > kcp_server.1333: Flags [.], ack 216, win 60, length 0
04:02:02.594866 IP my_ip.58226 > kcp_server.1333: Flags [F.], seq 138, ack 216, win 60, length 0
04:02:02.807831 IP my_ip.58226 > kcp_server.1333: Flags [F.], seq 138, ack 216, win 60, length 0
04:02:02.915746 IP my_ip.58214 > kcp_server.1333: Flags [F.], seq 56034656, ack 3513304703, win 60, length 0
04:02:03.023890 IP my_ip.58226 > kcp_server.1333: Flags [F.], seq 138, ack 216, win 60, length 0
04:02:03.459786 IP my_ip.58226 > kcp_server.1333: Flags [F.], seq 138, ack 216, win 60, length 0
04:02:04.323852 IP my_ip.58226 > kcp_server.1333: Flags [F.], seq 138, ack 216, win 60, length 0
04:02:06.051940 IP my_ip.58226 > kcp_server.1333: Flags [F.], seq 138, ack 216, win 60, length 0
04:02:09.571873 IP my_ip.58226 > kcp_server.1333: Flags [F.], seq 138, ack 216, win 60, length 0
04:02:14.814506 IP my_ip.58238 > kcp_server.1333: Flags [S], seq 3834772442, win 29200, options [mss 1460,sackOK,TS val 2126194878 ecr 0,nop,wscale 9], length 0
04:02:14.814759 IP kcp_server.1333 > my_ip.58238: Flags [S.], seq 2392666794, ack 3834772443, win 65535, options [mss 1460,wscale 5,sackOK,eol], length 0
04:02:14.823758 IP my_ip.58238 > kcp_server.1333: Flags [.], ack 1, win 58, length 0
04:02:14.823814 IP my_ip.58238 > kcp_server.1333: Flags [P.], seq 1:138, ack 1, win 58, length 137
04:02:14.824020 IP kcp_server.1333 > my_ip.58238: Flags [P.], seq 1:216, ack 138, win 65535, length 215
04:02:14.833297 IP my_ip.58238 > kcp_server.1333: Flags [.], ack 216, win 60, length 0
04:02:15.034183 IP my_ip.58238 > kcp_server.1333: Flags [F.], seq 138, ack 216, win 60, length 0
04:02:15.247940 IP my_ip.58238 > kcp_server.1333: Flags [F.], seq 138, ack 216, win 60, length 0
04:02:15.463941 IP my_ip.58238 > kcp_server.1333: Flags [F.], seq 138, ack 216, win 60, length 0
04:02:15.907845 IP my_ip.58238 > kcp_server.1333: Flags [F.], seq 138, ack 216, win 60, length 0
04:02:16.483878 IP my_ip.58226 > kcp_server.1333: Flags [F.], seq 138, ack 216, win 60, length 0
04:02:16.771921 IP my_ip.58238 > kcp_server.1333: Flags [F.], seq 138, ack 216, win 60, length 0
04:02:18.499846 IP my_ip.58238 > kcp_server.1333: Flags [F.], seq 138, ack 216, win 60, length 0
04:02:20.579950 IP my_ip.58106 > kcp_server.1333: Flags [F.], seq 4155382960, ack 1283038042, win 60, length 0
04:02:22.115834 IP my_ip.58238 > kcp_server.1333: Flags [F.], seq 138, ack 216, win 60, length 0
^C
30 packets captured
31 packets received by filter
0 packets dropped by kernel
root@kcp_server:~#
```

不知道抓对了没有。

**Comment by sdysj** [comment]
```
root@kcp_server:~# tcpdump port 1333
tcpdump: verbose output suppressed, use -v or -vv for full protocol decode
listening on venet0, link-type LINUX_SLL (Linux cooked), capture size 65535 bytes
04:02:01.891828 IP my_ip.58210 > kcp_server.1333: Flags [F.], seq 616562700, ack 1139322821, win 60, length 0
04:02:02.374274 IP my_ip.58226 > kcp_server.1333: Flags [S], seq 480526890, win 29200, options [mss 1460,sackOK,TS val 587117977 ecr 0,nop,wscale 9], length 0
04:02:02.374449 IP kcp_server.1333 > my_ip.58226: Flags [S.], seq 2774439657, ack 480526891, win 65535, options [mss 1460,wscale 5,sackOK,eol], length 0
04:02:02.383455 IP my_ip.58226 > kcp_server.1333: Flags [.], ack 1, win 58, length 0
04:02:02.383517 IP my_ip.58226 > kcp_server.1333: Flags [P.], seq 1:138, ack 1, win 58, length 137
04:02:02.383771 IP kcp_server.1333 > my_ip.58226: Flags [P.], seq 1:216, ack 138, win 65535, length 215
04:02:02.392845 IP my_ip.58226 > kcp_server.1333: Flags [.], ack 216, win 60, length 0
04:02:02.594866 IP my_ip.58226 > kcp_server.1333: Flags [F.], seq 138, ack 216, win 60, length 0
04:02:02.807831 IP my_ip.58226 > kcp_server.1333: Flags [F.], seq 138, ack 216, win 60, length 0
04:02:02.915746 IP my_ip.58214 > kcp_server.1333: Flags [F.], seq 56034656, ack 3513304703, win 60, length 0
04:02:03.023890 IP my_ip.58226 > kcp_server.1333: Flags [F.], seq 138, ack 216, win 60, length 0
04:02:03.459786 IP my_ip.58226 > kcp_server.1333: Flags [F.], seq 138, ack 216, win 60, length 0
04:02:04.323852 IP my_ip.58226 > kcp_server.1333: Flags [F.], seq 138, ack 216, win 60, length 0
04:02:06.051940 IP my_ip.58226 > kcp_server.1333: Flags [F.], seq 138, ack 216, win 60, length 0
04:02:09.571873 IP my_ip.58226 > kcp_server.1333: Flags [F.], seq 138, ack 216, win 60, length 0
04:02:14.814506 IP my_ip.58238 > kcp_server.1333: Flags [S], seq 3834772442, win 29200, options [mss 1460,sackOK,TS val 2126194878 ecr 0,nop,wscale 9], length 0
04:02:14.814759 IP kcp_server.1333 > my_ip.58238: Flags [S.], seq 2392666794, ack 3834772443, win 65535, options [mss 1460,wscale 5,sackOK,eol], length 0
04:02:14.823758 IP my_ip.58238 > kcp_server.1333: Flags [.], ack 1, win 58, length 0
04:02:14.823814 IP my_ip.58238 > kcp_server.1333: Flags [P.], seq 1:138, ack 1, win 58, length 137
04:02:14.824020 IP kcp_server.1333 > my_ip.58238: Flags [P.], seq 1:216, ack 138, win 65535, length 215
04:02:14.833297 IP my_ip.58238 > kcp_server.1333: Flags [.], ack 216, win 60, length 0
04:02:15.034183 IP my_ip.58238 > kcp_server.1333: Flags [F.], seq 138, ack 216, win 60, length 0
04:02:15.247940 IP my_ip.58238 > kcp_server.1333: Flags [F.], seq 138, ack 216, win 60, length 0
04:02:15.463941 IP my_ip.58238 > kcp_server.1333: Flags [F.], seq 138, ack 216, win 60, length 0
04:02:15.907845 IP my_ip.58238 > kcp_server.1333: Flags [F.], seq 138, ack 216, win 60, length 0
04:02:16.483878 IP my_ip.58226 > kcp_server.1333: Flags [F.], seq 138, ack 216, win 60, length 0
04:02:16.771921 IP my_ip.58238 > kcp_server.1333: Flags [F.], seq 138, ack 216, win 60, length 0
04:02:18.499846 IP my_ip.58238 > kcp_server.1333: Flags [F.], seq 138, ack 216, win 60, length 0
04:02:20.579950 IP my_ip.58106 > kcp_server.1333: Flags [F.], seq 4155382960, ack 1283038042, win 60, length 0
04:02:22.115834 IP my_ip.58238 > kcp_server.1333: Flags [F.], seq 138, ack 216, win 60, length 0
^C
30 packets captured
31 packets received by filter
0 packets dropped by kernel
root@kcp_server:~#
```

**Comment by ccsexyz** [comment]
额，你服务端和客户端的版本是一样的吗？

**Comment by sdysj** [comment]
一样啊，你这个改版从一开始就有这问题，我以为会更新解决所以才等到现在才发 issue。

**Comment by ccsexyz** [comment]
是只有arm平台下无法使用吗

**Comment by sdysj** [comment]
其他版本没试过，我是拿 OrangePI 开发板当网关的。

暂时正在用 https://github.com/Chion82/kcptun-raw
不过那个版本如果下载文件就不能浏览网页了，只占一个CPU核心，而go版这方面表现好一点。

**Comment by ccsexyz** [comment]
以前没人报告过类似问题,而且从抓的包上看,这不太像是我的客户端发出的包.

**Comment by ccsexyz** [comment]
```
08:45:20.073856 IP 20.83.237.221.broad.cd.sc.dynamic.163data.com.cn.12641 > vultr.http: Flags [S], seq 2997474860, win 12580, options [mss 1440,wscale 6,sackOK,eol], length 0
08:45:20.082754 IP vultr.http > 20.83.237.221.broad.cd.sc.dynamic.163data.com.cn.12641: Flags [S.], seq 258086238, ack 2997474861, win 65535, options [mss 1460,wscale 5,sackOK,eol], length 0
08:45:20.351097 IP 20.83.237.221.broad.cd.sc.dynamic.163data.com.cn.12641 > vultr.http: Flags [.], ack 1, win 12580, length 0
08:45:21.095565 IP 20.83.237.221.broad.cd.sc.dynamic.163data.com.cn.12641 > vultr.http: Flags [P.], seq 1:193, ack 1, win 12580, length 192: HTTP: POST /UbQIbHplVK HTTP/1.1
08:45:21.096504 IP vultr.http > 20.83.237.221.broad.cd.sc.dynamic.163data.com.cn.12641: Flags [P.], seq 1:216, ack 193, win 65535, length 215: HTTP: HTTP/1.1 200 OK
08:45:21.321163 IP vultr.http > 20.83.237.221.broad.cd.sc.dynamic.163data.com.cn.12641: Flags [.], ack 193, win 65535, length 0
08:45:22.275397 IP vultr.http > 20.83.237.221.broad.cd.sc.dynamic.163data.com.cn.12057: Flags [P.], seq 3190818902:3190818962, ack 4201039991, win 65535, length 60: HTTP
08:45:23.363361 IP vultr.http > 20.83.237.221.broad.cd.sc.dynamic.163data.com.cn.12057: Flags [P.], seq 60:120, ack 1, win 65535, length 60: HTTP
```
你可以对比下第一个 syn 报文的 options 字段  
从你抓的包上来看，似乎很像是由内核协议栈发出的包

**Comment by sdysj** [comment]
重新测试过还是这样，或许踩到坑了，先关闭吧。

**Comment by ccsexyz** [comment]
检查你本地网络环境吧,不要前置任何四层以上的代理

**Comment by ccsexyz** [comment]
现在看来应该是和 https://github.com/ccsexyz/kcpraw/issues/10 一样的原因导致的，运营商劫持HTTP请求导致客户端出现了误判，等我修掉这个问题应该就好了，暂时可以先用nohttp禁用HTTP功能。
