### ISSUE TITLE
broken pipe,retry too many times

### ISSUE THREAD

**Issue by mackyzhan** [ccsexyz/kcpraw#10]
**Server:Debian 6 x86**

2017/09/10 04:17:19.406703 main.go:311: version: 20170904
2017/09/10 04:17:19.420736 main.go:344: listening on: 104.X.X.15:6000
2017/09/10 04:17:19.420766 main.go:345: target: 127.0.0.1:5000
2017/09/10 04:17:19.420776 main.go:346: encryption: aes-128
2017/09/10 04:17:19.420788 main.go:347: nodelay parameters: 0 30 2 1
2017/09/10 04:17:19.420797 main.go:348: sndwnd: 1024 rcvwnd: 1024
2017/09/10 04:17:19.420806 main.go:349: compression: false
2017/09/10 04:17:19.420815 main.go:350: mtu: 1335
2017/09/10 04:17:19.420824 main.go:351: datashard: 12 parityshard: 4
2017/09/10 04:17:19.420833 main.go:352: acknodelay: false
2017/09/10 04:17:19.420858 main.go:353: dscp: 0
2017/09/10 04:17:19.420867 main.go:354: sockbuf: 4194304
2017/09/10 04:17:19.420876 main.go:355: keepalive: 10
2017/09/10 04:17:19.420885 main.go:356: snmplog: kcprawsnmp.log
2017/09/10 04:17:19.420893 main.go:357: snmpperiod: 60
2017/09/10 04:17:19.420902 main.go:358: usemul: true
2017/09/10 04:17:19.420911 main.go:359: udp mode: false
2017/09/10 04:17:19.420919 main.go:360: pprof listen at: 
2017/09/10 04:18:56.420366 main.go:402: broken pipe
github.com/xtaci/kcp-go.(*Listener).AcceptKCP
	/Users/johnsonjohn/Go/src/github.com/xtaci/kcp-go/sess.go:823
main.main.func1
	/Users/johnsonjohn/Go/src/github.com/ccsexyz/kcpraw/server/main.go:378
github.com/urfave/cli.HandleAction
	/Users/johnsonjohn/Go/src/github.com/urfave/cli/app.go:490
github.com/urfave/cli.(*App).Run
	/Users/johnsonjohn/Go/src/github.com/urfave/cli/app.go:264
main.main
	/Users/johnsonjohn/Go/src/github.com/ccsexyz/kcpraw/server/main.go:406
runtime.main
	/usr/local/go/src/runtime/proc.go:185
runtime.goexit
	/usr/local/go/src/runtime/asm_386.s:1635
2017/09/10 04:18:56.420552 main.go:402: broken pipe
github.com/xtaci/kcp-go.(*Listener).AcceptKCP
	/Users/johnsonjohn/Go/src/github.com/xtaci/kcp-go/sess.go:823
main.main.func1
	/Users/johnsonjohn/Go/src/github.com/ccsexyz/kcpraw/server/main.go:378
github.com/urfave/cli.HandleAction
	/Users/johnsonjohn/Go/src/github.com/urfave/cli/app.go:490
github.com/urfave/cli.(*App).Run
	/Users/johnsonjohn/Go/src/github.com/urfave/cli/app.go:264
main.main
	/Users/johnsonjohn/Go/src/github.com/ccsexyz/kcpraw/server/main.go:406
runtime.main
	/usr/local/go/src/runtime/proc.go:185
runtime.goexit
	/usr/local/go/src/runtime/asm_386.s:1635
__
**Client:win7 AMD64**
2017/09/10 13:09:41 main.go:306: version: SELFBUILD
2017/09/10 13:09:41 main.go:342: listening on: 127.0.0.1:1088
2017/09/10 13:09:41 main.go:343: encryption: aes-128
2017/09/10 13:09:41 main.go:344: nodelay parameters: 0 30 2 1
2017/09/10 13:09:41 main.go:345: remote address: 104.X.X.15:6000
2017/09/10 13:09:41 main.go:346: sndwnd: 512 rcvwnd: 1024
2017/09/10 13:09:41 main.go:347: compression: false
2017/09/10 13:09:41 main.go:348: mtu: 1335
2017/09/10 13:09:41 main.go:349: datashard: 12 parityshard: 4
2017/09/10 13:09:41 main.go:350: acknodelay: false
2017/09/10 13:09:41 main.go:351: dscp: 0
2017/09/10 13:09:41 main.go:352: sockbuf: 4194304
2017/09/10 13:09:41 main.go:353: keepalive: 10
2017/09/10 13:09:41 main.go:354: conn: 1
2017/09/10 13:09:41 main.go:355: autoexpire: 0
2017/09/10 13:09:41 main.go:356: snmplog: 
2017/09/10 13:09:41 main.go:357: snmpperiod: 60
2017/09/10 13:09:41 main.go:358: scavengettl: 600
2017/09/10 13:09:41 main.go:366: httphost:  www.bing.com
2017/09/10 13:09:41 main.go:91: retry too many times
net.DialRAW
github.com/ccsexyz/kcp-go-raw.DialWithOptions
	C:/WhyGo/src/github.com/ccsexyz/kcp-go-raw/sess.go:34
main.main.func1.1
	C:/WhyGo/src/github.com/ccsexyz/kcpraw/client/main.go:374
main.main.func1
	C:/WhyGo/src/github.com/ccsexyz/kcpraw/client/main.go:416
github.com/urfave/cli.HandleAction
	C:/WhyGo/src/github.com/urfave/cli/app.go:490
github.com/urfave/cli.(*App).Run
	C:/WhyGo/src/github.com/urfave/cli/app.go:264
main.main
	C:/WhyGo/src/github.com/ccsexyz/kcpraw/client/main.go:455
runtime.main
	C:/Go/src/runtime/proc.go:185
runtime.goexit
	C:/Go/src/runtime/asm_amd64.s:2197
createConn()
main.main.func1.1
	C:/WhyGo/src/github.com/ccsexyz/kcpraw/client/main.go:376
main.main.func1
	C:/WhyGo/src/github.com/ccsexyz/kcpraw/client/main.go:416
github.com/urfave/cli.HandleAction
	C:/WhyGo/src/github.com/urfave/cli/app.go:490
github.com/urfave/cli.(*App).Run
	C:/WhyGo/src/github.com/urfave/cli/app.go:264
main.main
	C:/WhyGo/src/github.com/ccsexyz/kcpraw/client/main.go:455
runtime.main
	C:/Go/src/runtime/proc.go:185
runtime.goexit
	C:/Go/src/runtime/asm_amd64.s:2197

**Comment by ccsexyz** [comment]
服务端禁用掉usemul，现在releases目录里的win二进制是比较老的版本，还不支持

**Comment by mackyzhan** [comment]
自动添加的iptables中x11-1和x11-6 是什么？
Chain INPUT (policy ACCEPT)
target     prot opt source               destination         
ACCEPT     tcp  --  anywhere             freedom             tcp dpt:x11-1 
ACCEPT     tcp  --  localhost.localdomain  anywhere            multiport dports 5901,5902 
DROP       tcp  --  anywhere             anywhere            multiport dports smtp,pop3,5901,5902,pop2,imap2,ssmtp,pop3s,imaps 

Chain FORWARD (policy ACCEPT)
target     prot opt source               destination         

Chain OUTPUT (policy ACCEPT)
target     prot opt source               destination         
DROP       tcp  --  freedom              anywhere            tcp spt:x11-1 flags:RST/RST 
DROP       tcp  --  freedom              anywhere            tcp spt:x11-6 flags:RST/RST

**Comment by ccsexyz** [comment]
应该是 6000 端口的别名，你可以 grep 一下 /etc/services

**Comment by mackyzhan** [comment]
客户端：
换了untuntu 17后
nohttp为true、udp为false时,正常上网了。
nohttp为true、udp为true时,无法上网。
但是nohttp为false、udp为false时报错：retry too many times,客户端直接退出。

**Comment by ccsexyz** [comment]
nohtp 为 false 的时候抓包看看
tcpdump host kcp-server-ip and port kcp-server-port and proto tcp

**Comment by mackyzhan** [comment]
tcpdump: verbose output suppressed, use -v or -vv for full protocol decode
listening on enp0s3, link-type EN10MB (Ethernet), capture size 262144 bytes
21:57:02.298859 IP 10.0.2.15.56578 > 104.X.X.15.x11-1: Flags [S], seq 4026064784, win 12580, options [mss 1460,wscale 5,sackOK,eol], length 0
21:57:02.602316 IP 104.X.X.15.x11-1 > 10.0.2.15.56578: Flags [S.], seq 102016001, ack 4026064785, win 65535, options [mss 1460], length 0
21:57:02.602771 IP 10.0.2.15.56578 > 104.X.X.15.x11-1: Flags [.], ack 1, win 12580, length 0
21:57:02.603211 IP 10.0.2.15.56578 > 104.X.X.15.x11-1: Flags [P.], seq 1:173, ack 1, win 12580, length 172
21:57:02.604112 IP 104.X.X.15.x11-1 > 10.0.2.15.56578: Flags [.], ack 173, win 65535, length 0
21:57:02.605352 IP 10.0.2.15.56578 > 104.X.X.15.x11-1: Flags [P.], seq 1:173, ack 1, win 12580, length 172
21:57:02.605681 IP 104.X.X.15.x11-1 > 10.0.2.15.56578: Flags [.], ack 173, win 65535, length 0
21:57:02.606462 IP 10.0.2.15.56578 > 104.X.X.15.x11-1: Flags [P.], seq 1:173, ack 1, win 12580, length 172
21:57:02.606752 IP 104.X.X.15.x11-1 > 10.0.2.15.56578: Flags [.], ack 173, win 65535, length 0
21:57:02.607493 IP 10.0.2.15.56578 > 104.X.X.15.x11-1: Flags [P.], seq 1:173, ack 1, win 12580, length 172
21:57:02.607808 IP 104.X.X.15.x11-1 > 10.0.2.15.56578: Flags [.], ack 173, win 65535, length 0
21:57:02.608567 IP 10.0.2.15.56578 > 104.X.X.15.x11-1: Flags [P.], seq 1:173, ack 1, win 12580, length 172
21:57:02.608979 IP 104.X.X.15.x11-1 > 10.0.2.15.56578: Flags [.], ack 173, win 65535, length 0
21:57:02.609945 IP 10.0.2.15.56578 > 104.X.X.15.x11-1: Flags [P.], seq 1:173, ack 1, win 12580, length 172
21:57:02.610265 IP 104.X.X.15.x11-1 > 10.0.2.15.56578: Flags [.], ack 173, win 65535, length 0
21:57:02.619304 IP 10.0.2.15.56578 > 104.X.X.15.x11-1: Flags [F], seq 4026064785, win 12580, length 0
21:57:02.902992 IP 104.X.X.15.x11-1 > 10.0.2.15.56578: Flags [P.], seq 1:216, ack 173, win 65535, length 215
21:57:02.903054 IP 10.0.2.15.56578 > 104.X.X.15.x11-1: Flags [R], seq 4026064957, win 0, length 0

**Comment by ccsexyz** [comment]
从抓包记录上看导致问题的原因应该是不知道哪儿来的ACK干扰了客户端，客户端发送第一个数据包后不到1ms就收到了ACK
`
21:57:02.603211 IP 10.0.2.15.56578 > 104.X.X.15.x11-1: Flags [P.], seq 1:173, ack 1, win 12580, length 172
21:57:02.604112 IP 104.X.X.15.x11-1 > 10.0.2.15.56578: Flags [.], ack 173, win 65535, length 0
`
显然是中间有设备搞事情

**Comment by ccsexyz** [comment]
最好是把 http 功能给关闭掉，其实开或者不开没多大差别的

**Comment by mackyzhan** [comment]
移动的宽带限制多,NAT也多,算了不折腾了，谢谢!

**Comment by ccsexyz** [comment]
严格意义上来说不应该被干扰的，应该算是个bug，我有时间改下吧
